{
  "schema_version": 1,
  "default_branch": "main",
  "thresholds": {
    "MAX_FILE_LINES": 300,
    "MIN_NEW_FILE_COVERAGE": 60
  },
  "ratchet": { "strict": true, "epsilon": 0.0 },
  "metrics": {
    "coverage":    { "enabled": true },
    "duplication": { "enabled": true },
    "lint":        { "enabled": true },
    "file_size":   { "enabled": true },
    "security":    { "enabled": true, "block_severities": ["critical"], "warn_severities": ["high"] }
  },
  "adapter": {
    "command": "npx --yes @quality-gate/adapter-react@0.1.0",
    "name": "react",
    "version": "0.1.0"
  }
}
